input_question,output_answer
"¿Cuáles son las mejores prácticas para gestionar reuniones de equipo?","Para gestionar reuniones de equipo de manera efectiva, se debe enviar una agenda clara con antelación, establecer objetivos específicos y asignar un moderador. No se deben prolongar las reuniones más de lo necesario ni permitir distracciones."
"¿Qué se debe evitar al redactar correos electrónicos corporativos?","Al redactar correos electrónicos corporativos, se deben evitar errores de ortografía, ambigüedades y un tono demasiado informal. Es importante usar un lenguaje claro, ser conciso y verificar siempre la información antes de enviarla."
"¿Cómo mantener la productividad en un entorno de oficina?","Para mantener la productividad, se deben establecer metas claras, tomar descansos cortos para evitar la fatiga y usar herramientas de gestión de tareas. No se debe sobrecargar a los empleados con tareas excesivas ni fomentar una cultura de multitarea constante, ya que puede reducir la calidad del trabajo."
"¿Qué comportamientos no son apropiados en reuniones formales?","No se deben interrumpir a otros mientras hablan, usar un lenguaje inapropiado ni desviarse de la agenda. Siempre se debe mantener un tono profesional y respetar las opiniones de los demás."
"¿Cuáles son las claves para una buena organización de documentos en la oficina?","Una buena organización de documentos implica etiquetar correctamente los archivos, usar un sistema de clasificación coherente y realizar copias de seguridad periódicamente. No se debe dejar información sensible en lugares accesibles ni acumular documentos sin orden."
